Keywords,Descriptions,Cluster
Harvard University,"5 hours ago · Harvard University is devoted to excellence in teaching, learning, and research, and to developing leaders in many disciplines who make  Harvard University is a private Ivy League research university in Cambridge, Massachusetts, with about 6,700 undergraduate students and about 13,100 .",0
Web directory,"A web directory or link directory is an online list or catalog of websites. That is, it is a directory on the World Wide Web of (all or part of) the W Jan 29, 2019 · In the early days of SEO, web directories were the thing. Back then, the Google algorithm was a lot easier to game. If your site was li Web Directory - Submit your website to the Internet's fastest growing directory! Category based and cross-referenced.",4
Harvard Library,"Welcome to Library.harvard ... Connect with the library materials you need to get your work done. ... Use Harvard Library's Special Collections and Ar HOLLIS is the Harvard Library's catalog. Search HOLLIS for books, articles ... Use Interlibrary Loan for items from libraries around the world. Reques The Harvard Library is the umbrella organization for the Harvard University libraries and their .... Harvard Library also has a robust collection of d",3
Recreation,"These example sentences are selected automatically from various online news sources to reflect current usage of the word 'recreation.'  Views expresse The Recreation Department provides quality, affordable and accessible recreational opportunities for residents of all ages in well-designed and mainta Jun 17, 2019 · Expect traffic impacts from the Cambridge Half Marathon Sunday, Nov. 3, from 7-10 a.m., in Kendall Square, MIT, CambridgePort, Riversid",4
Stanford,"Stanford University, one of the world's leading teaching and research institutions, is dedicated to finding solutions to big challenges and to prepari Leland Stanford Junior University (Stanford University or Stanford) is a private research university in Stanford, California. Stanford is known for it",0
Nonprofit organization,"A nonprofit organization, also known as a non-business entity, not-for-profit organization, or nonprofit institution, is dedicated to furthering a par May 13, 2019 · A nonprofit organization is a business that has been granted tax-exempt status by the Internal Revenue Service (IRS) because it further America's 1.3 million charitable nonprofits feed, heal, shelter, educate, inspire ... not paying out profits (“no part of the organization's net earni",4
Food truck,"Jul 19, 2019 · You can find information on food trucks by neighborhood. We also have a map that features food trucks from across the City, including t Cambridge Food Truck Program Schedule: May 2019 - April 2020.  The following trucks were awarded shifts through the Cambridge Food Truck Program.  To ",4
Biology,"Biology is the natural science that studies life and living organisms, including their physical structure, chemical processes, molecular interactions, Aug 10, 2017 · Biologists study the structure, function, growth, origin, evolution and distribution of living organisms.  There are generally consider Life is beautiful! From atoms to cells, from genes to proteins, from populations to ecosystems, biology is the study of the fascinating and intricate ",1
Engineer,"Engineers, as practitioners of engineering, are professionals who invent, design, analyze, build, and test machines, systems, structures and materials Aug 22, 2014 · Engineering is the application of science and math to solve problems. Engineers figure out how things work and find practical uses for  Interested in the types of engineering degrees available? View the most in-depth list of engineering degree program comparisons & schools online.
High",1
Cornell University,"Cornell University is a private research university that provides an exceptional education for undergraduates and graduate and professional students.  Cornell University is a private and statutory Ivy League research university in Ithaca, New York. Founded in 1865 by Ezra Cornell and Andrew Dickson W",0
John A Paulson School Of Engineering And Applied Sciences,"American Indian Science and Engineering Society (AISES) National Conference. Harvard is a Proud Participant and Exhibitor. Thursday. |. Wisconsin Cent Through the Graduate School of Arts and Sciences, prospective students apply ... at the Harvard John A. Paulson School of Engineering and Applied Scie The Harvard John A. Paulson School of Engineering and Applied Sciences ( SEAS) is the engineering school within Harvard University's Faculty of Arts a",2
Ivy League,"The official athletics website for Ivy League. ... Ivy Interactions. #OneIvy. MXC_1101. Penn Pulls Out Men's Team Title, Columbia's Vasbinder Claims T The Ivy League is an American collegiate athletic conference comprising sports teams from eight private universities in the Northeastern United States Sep 23, 2019 · Ivy League schools are considered the most sought-after institutions of higher learning in the country and around the world. These eigh",4
Lecture,"These example sentences are selected automatically from various online news sources to reflect current usage of the word 'lecture.'  Views expressed i A lecture is an oral presentation intended to present information or teach people about a particular subject, for example by a university or college t Lecture definition, a speech read or delivered before an audience or class, especially for instruction or to set forth some subject: a lecture on Pica",1
Graduation ceremony,"Graduation is the award of a diploma or academic degree, or the ceremony that is sometimes associated with it, in which students become graduates. The Mar 18, 2019 · The day has come and you're finally graduating. Learn everything you need to know about what happens during a graduation ceremony with  There is one COM Graduate Convocation (Hooding Ceremony) and one All- University Commencement Ceremony held each year in May. Please read this page ..",4
Computer Science,"Computer science is the study of processes that interact with data and that can be represented as data in the form of programs. It enables the use of  Computer Science is the study of computers and computational systems. Unlike electrical and computer engineers, computer scientists deal mostly with s Oct 10, 2019 · Computer Science at the Harvard School of Engineering studies both the fundamentals of computation and computation's interaction with t",2
Harvard Summer School,"Summer courses for adult & college students, programs for high school students, and study abroad programs. Study on campus or online. Harvard is committed to helping you cover the cost of your entire education, including summer school. If you receive need-based aid during the regular Harvard Summer School (founded 1871) is a summer school located at Harvard University. It serves more than 5,000 students per year.

Established: 1871",2
Harvard Art Museums,"The Harvard Art Museums — the Fogg, Busch-Reisinger, and Arthur M. Sackler Museums. Advanced Search. Classification; Work Type; Technique / Medium ... The Harvard Art Museums are committed to creating an environment that fosters ... The Art Study Center welcomes visitors by appointment (free with mus November 17, 2018–November 14, 2021 University Collections Gallery: African Art, Harvard Art Museums. This exhibition highlights artistic innovation a",3
Pay grade,"A pay grade is a step within a compensation system that defines the amount of pay an employee will receive. The pay grade is generally defined by the  A pay grade is a unit in systems of monetary compensation for employment. It is commonly used in public service, both civil and military, but also for Knowing your pay grade details will help you get paid what you're worth.",1
Economics,"Economics is the social science that studies the production, distribution, and consumption of goods and services. Economics focuses on the behaviour a Economics can be defined in a few different ways. It's the study of scarcity, the study of how people use resources and respond to incentives, or the ",1
Google Scholar,The system can't perform the operation now. Try again later. Advanced search. Find articles. with all of the words. with the exact phrase. with at lea,1
Brown University,"Brown is a leading research university, home to world-renowned faculty and also an innovative educational institution where the curiosity, creativity  Brown University is a private Ivy League research university in Providence, Rhode Island. Founded in 1764 as the College in the English Colony of Rhod Rating  5.0  (7) Brown University is a private institution that was founded in 1764. It has a total undergraduate enrollment of 7,043, its setting is ",0
Spring break,"Spring break is a vacation period in early spring at universities and schools which started during the 1930s in the United States and is now observed  The best spring break of your life! All-inclusive spring break packages to hot destinations with the best nightlife, wild activities, and crazy fun. Spring Break spans late February to mid-April, with March being the peak period. However, dates can vary depending on your college or university, so b",1
WiFi,"Wi-Fi is a family of radio technologies commonly used for wireless local area networking .... The name is sometimes written as WiFi, Wifi, or wifi, bu XFINITY® WiFi by Comcast offers wireless internet service at millions of hotspots. Enjoy the fastest hotspots with the most Internet on the Go coverag We use cookies on this site to enhance your user experience. By clicking any link on this page you are giving your consent for us to set cookies. No, ",1
Syllabus,"A syllabus or specification is an academic document that communicates information about a specific course and defines expectations and responsibilitie There's never a bad time to re-examine and rethink how to write your syllabus. This guide walks you through everything you need to know, with specific About Syllabi. A syllabus is your guide to a course and what will be expected of you in the course. Generally it will include course policies, rules a",1
study abroad,"Study Abroad and the BU Hub.  Beginning in the Fall 2019 students will be able to fulfill HUB requirements on many BU-administered programs.  ... It’s Top Study Abroad Program Opportunities.  ... Maximo Nivel offers university programs year round including Fall Semester, Winter Session (J-term), Spri Explore Study Abroad Programs | Intern Abroad, Intensive Language Abroad, Teach Abroad, Volunteer Abroad, Full Degrees Abroad on the Top ...
Scholarsh",4
Yale University,"Since its founding in 1701, Yale University has been dedicated to expanding and sharing knowledge, inspiring innovation, and preserving cultural and s Yale University is a private Ivy League research university in New Haven, Connecticut. Founded in 1701, it is the third-oldest institution of higher e Heroes Day at the Yale Bowl! With the help of Handsome Dan, today’s @yalefootball game recognized military veterans & first responders #BoolaBoola #Ya",0
Faculty,"Faculty definition is - ability, power: such as. How to use faculty in a sentence. Synonym Discussion of faculty. Faculty definition, an ability, natural or acquired, for a particular kind of action: a faculty for making friends easily. See more. Oct 21, 2013 · Harvard students have access to some of the world's greatest scholars. Learn more about our faculty and their impactful role in the Col",3
Boston University Terriers mens ice hockey,The official 2019-20 Men's Ice Hockey schedule for the Boston University Terriers . The official 2018-19 Men's Ice Hockey schedule for the Boston University Terriers . The official 2019-20 Men's Ice Hockey Roster for the Boston University Terriers.,4
Bauhaus,"The Staatliches Bauhaus commonly known as the Bauhaus, was a German art school operational from 1919 to 1933 that combined crafts and the fine arts, a The Bauhaus was founded in 1919 in the city of Weimar by German architect Walter Gropius (1883–1969).  ... Gropius explained this vision for a union o Nov 21, 2010 · The Bauhaus school redefined artistic creativity and manufacturing, fine and applied art, and lead Gropius, Klee, Albers, Breuer+ to fu",2
Hasty Pudding Theatricals,"The Hasty Pudding Institute of 1770 comprises the Hasty Pudding Club, Hasty ... The Hasty Pudding Theatricals is the third oldest theater organization PUNS The Hasty Pudding Theatricals is the third oldest theater organization in the world, preceded only by the Comédie-Française and the Oberammergau  The Hasty Pudding Theatricals, known informally simply as The Pudding, is a theatrical student society at Harvard University, known for its burlesque ",3
Brandeis,"Brandeis University is a private research university with a liberal arts focus in Waltham/Boston, Massachusetts. Brandeis University /ˈbrændaɪs/ is a private research university in Waltham, Massachusetts. Founded in 1948 as a non-sectarian, coeducational institut 🐇🐇",0
The Harvard Crimson,"3 days ago · Fifty-two percent of respondents to Harvard's pilot Pulse Survey on Inclusion and Belong said they agree or strongly agree with a stateme The Harvard Crimson, the daily student newspaper of Harvard University, was founded in 1873. It is the only daily newspaper in Cambridge, Massachusett Brown University Physics professor Sylvester J. Gates, Jr. described how scientists found evidence for Albert Einstein’s theory of relativity in a tal",3
Carat,"We're Carat, the #1 Global Media Network. (RECMA, 2018) The carat (ct) is a unit of mass equal to 200 mg (0.00705 oz) or 0.00643 troy oz, and is used for measuring gemstones and pearls. The current definiti Crossroads & XID Users: It may take an hour from the time you create your account for CARAT to recognize your XID. Non-Harvard applicants create your ",3
Editing,"The Best Online Photo Editor, Ever.  ... Taking pictures is fun – shouldn't your photo editor be fun, too?  ... BeFunky Photo Editor has smart enhance Experience smarter and faster photo editing. Pixlr X is the only photo editor you need for quick yet professional edits. Designed with just the right  Editing is the process of selecting and preparing writing, photography, visual, audible, and film media used to convey information. The editing proces",1
Lil Pump,"Gazzy Garcia (born August 17, 2000), known professionally as Lil Pump, is an American rapper and songwriter. He is known for his hyperactive public pe Oct 23, 2017 · Lil pump 442,850,427 views.  50+ videos Play all Mix - Lil Pump - ""Gucci Gang"" (Official ...Duration: 2:11
Posted: Oct 23, 2017 Official YouTube channel of Tha Lights Global artist Lil Pump.",1
Harvard University Health Services,"To Educate. Primary and specialty care for the Harvard community. ... Nutrition · Mount Auburn Obstetrics and Gynecology at Harvard University Health  If you have a Harvard ID number but don't have a HarvardKey, you may be able to ... assigned to you by HUHS Health Information Services/Medical Record Comprehensive coverage for Harvard students and their dependents. Let us simplify how Harvard health insurance works for you. Learn more.",3
Natural history,"The museum combines historic exhibits drawn from the University's vast collections with new and changing, multimedia exhibitions. Highlights include H The Harvard Museum of Natural History is adjacent to the Peabody Museum of Archaeology & Ethnology, and admission to one museum admits you to both ... Natural history is a domain of inquiry involving organisms, including animals, fungi and plants, in their natural environment, leaning more towards ob",3
Campus,"Company · Blog Careers Infinite Campus Foundation Magazine News Our Technology Partners Stores Success Stories Videos ...
Login · Parent or Student ·  A campus is traditionally the land on which a college or university and related institutional buildings are situated. Usually a college campus include From our libraries to our museums, our support services to our common spaces, our campus is teeming with resources to guide your experience.",1
Columbia University,"Five individuals sit around a table at Columbia Startup Lab. Innovation. The Columbia ... University-wide commencement information. Annette Lopes smil Columbia University is a private Ivy League research university in New York City. Established in 1754 near the Upper West Side region of Manhattan, Co",0
Gazette,"A breakdown of upcoming lectures, presentations and gatherings hosted by Harvard University. Official news from Harvard covering innovation in teaching, learning, and research.
Harvard Events · About · News + · Science & Technology A gazette is an official journal, a newspaper of record, or simply a newspaper. In English- and French-speaking countries, newspaper publishers have a",3
Master of Business Administration,"The Master of Business Administration (MBA or M.B.A.) degree originated in the United States in the early 20th century when the country industrialized Sep 23, 2019 · A master of business administration (MBA) is a graduate degree that provides theoretical and practical training for business or investm The Master of Business Administration (MBA) degree program at Cambridge College offers a graduate seminar series designed to develop team work and ...",4
Dropping out,"Dropping out means leaving high school, college, university or another group for practical reasons, necessities, or disillusionment with the system fr Discover 7 steps for how to drop out of high school and create a successful future . Plus, learn some critical facts to consider before taking the plu",2
Squash,"The different type of Squash - summer and winter for squash are only based on current usage, not on actuality. Learn about the different types of squa Jul 16, 2019 · Come fall, your squash options can get a little overwhelming. So here's a comprehensive breakdown of some of the most popular and versa Oct 14, 2019 · Whether you're baking or cooking, squash can be absolutely delicious in a variety of meals. Here's everything you need to know about sq",4
Princeton University,"Oct 15, 2019 · Through teaching and research, we educate people who will contribute to society and develop knowledge that will make a difference in th Princeton University is a private Ivy League research university in Princeton, New Jersey. Founded in 1746 in Elizabeth as the College of New Jersey,  Princeton University is a private institution that was founded in 1746. It has a total undergraduate enrollment of 5,428, its setting is suburban, and",0
Dartmouth College,"Music: Dartmouth College Wind Ensemble. November 2. Athletics at home: Women's tennis Big Green Invitational; equestrian; women's ice hockey. November Dartmouth College is a private Ivy League research university in Hanover, New Hampshire, United States. Established in 1769 by Eleazar Wheelock, it is",1
Undergraduate education,"Undergraduate education is education conducted after secondary education and prior to post-graduate education. It typically includes all the academic  Undergraduate education is a level of education wherein a student completes their first degree. The first degree of an undergraduate degree is normall This section outlines the general requirements together with other important aspects of undergraduate education, including admissions and financial ai",1
Harvard University Employees Credit Union,"Get exclusive access to the very best banking solutions and exceptional customer service with the Harvard University Employees Credit Union. As a not-for-profit cooperative, the Harvard University Employees Credit Union ( HUECU) helps members achieve their financial goals by offering low-co Make sure you are ready for our technology upgrade happening this weekend by taking a few simple steps.Prepare For Launch This Weekend hubs.ly/H0lBjH8",3
Harvard Real Estate,"We also own and manage an off-campus commercial office park and retail locations that are leased to non-University clients.  ... Harvard University Ho Faculty Real Estate Services, a division of Harvard University Housing, provides a broad range of housing services to both current faculty members and Meet Our Property Management Teams · Harvard Real Estate - Property Management · Meet Our Leasing Team · Harvard Real Estate - Leasing · Our Promise t",3
Thesis,"This handout describes what a thesis statement is, how thesis statements work in your writing, and how you can craft or refine one for your draft.  .. An effective thesis cannot be answered with a simple ""yes"" or ""no."" A thesis is not a topic; nor is it a fact; nor is it an opinion. ""Reasons for the  A thesis statement focuses your ideas into one or two sentences. It should present the topic of your paper and also make a comment about your position",1
Grant,"Grants are non-repayable funds or products disbursed or given by one party ( grant makers), often a government department, corporation, foundation or  Grant definition is - to consent to carry out for a person : allow fulfillment of. How to use grant in a sentence. Synonym Discussion of grant. Convenience Comes to Federal Grants. Download the Grants.gov Mobile App to search and submit on the go. Download on the App Store · Get it on Google .",1
Tutor,"Get a tutor 24/7 in 40+ subjects including Math, Science and English. We help thousands of students get better grades every day. Get an expert tutor n 799 Tutor jobs available in Cambridge, MA on Indeed.com. Apply to Tutor, Test Preparation Tutor and more! Find 190 affordable tutors in Cambridge, MA. Search local listings by rates, reviews, experience, and more - all for free. Match made on Care.com ever",1
Postdoctoral researcher,A postdoctoral researcher or postdoc is a person professionally conducting research after the completion of their doctoral studies (typically a PhD).  Postdocs are not valuable in academia. It's simple economics. Here's why a postdoctoral researcher position will pay you less than a librarian's salar Postdoctoral Research Opportunities with annual salaries and stipends up to $75000 per year.,0
Doctor of Medicine,"Doctor of Medicine is a medical degree, the meaning of which varies between different jurisdictions. In the United States, Canada and some other count Duke's Doctor of Medicine (M.D.) Program seeks to prepare a diverse student body to pursue a spectrum of medical career options in order to become phy Nov 21, 2017 · Research the requirements to become a doctor of medicine. Learn about the job description and ...Duration: 5:12
Posted: Nov 21, 2017",0
Resource,"These example sentences are selected automatically from various online news sources to reflect current usage of the word 'resource.'  Views expressed  Resource definition, a source of supply, support, or aid, especially one that can be readily drawn upon when needed. See more. A resource is a source or supply from which a benefit is produced and that has some utility. Resources can broadly be classified upon their availabili",1
PubMed,"PubMed comprises more than 30 million citations for biomedical literature from MEDLINE, life science journals, and online books. Citations may include PubMed Central® (PMC) is a free full-text archive of biomedical and life sciences journal literature at the U.S. National Institutes of Health's Natio",1
Harvard Physics Department,"Karen Olsson will talk with Mallinckrodt Professor of Physics Melissa Franklin about her Olsson's new book, The Weil Conjecture, with tells the story  The Department continued its commitment to secondary school physics education with the program ""Harvard Project Physics."" As faculty interest in the C The latest Tweets from Harvard Physics (@harvardphysics). Harvard University Department of Physics LinkedIn: http://t.co/ylf8QtGQI1. Cambridge, MA.",3
SAP Concur,"SAP Concur simplifies travel, expense and invoice management for total visibility and greater control. Start your test drive now! No information is available for this page. · Learn why SAP Concur (formerly, Concur Technologies) is an American SaaS company, providing travel and expense management services to businesses.

Number of emp",1
University of Massachusetts Amherst,"University of Massachusetts at Amherst. ... to the executive order on immigration and other federal actions that affect UMass Amherst students, facult The University of Massachusetts Amherst is a public research and land-grant university in Amherst, Massachusetts. It is the flagship campus of the Uni Rating  3.7  (3,389) UMass is a highly rated public university located in Amherst Center, Massachusetts in the Springfield, MA Area. It is a large ins",0
Harvard Dining Services,"Harvard University Dining Services. Menu October 26, 2019. Undergraduate Dining · Graduate ... Take a look at Dining@Harvard: The First 380 Years! Cam 6 days ago · Harvard University Hospitality and Dining Services. < Back to menus · Monday, October 28 · Tuesday, October 29 · Wednesday, October 30 .. If you live in on-campus housing, you participate in the board plan and enjoy a comprehensive dining program during your session. Your board plan allo",3
University of California Los Angeles,"UCLA advances knowledge, addresses pressing societal needs and creates a university enriched by diverse perspectives where all individuals can flouris The University of California, Los Angeles (UCLA), is a public research university in Los Angeles. It became the Southern Branch of the University of C Rating  5.0  (27) University of California—Los Angeles is a public institution that was founded in 1919. It has a total undergraduate enrollment of 31",0
