Keywords,Descriptions,Cluster
Seminar,"A seminar is a form of academic instruction, either at an academic institution or offered by a commercial or professional organization. It has the fun Seminar definition is - a group of advanced students studying under a professor with each doing original research and all exchanging results through r A seminar may be defined as a gathering of people for the purpose of discussing a stated topic. Such gatherings are usually interactive sessions where",0
Final examination,"A final examination, annual, exam, final interview, or simply final, is a test given to students at the end of a course of study or training. Although Final Examination is a 2003 American horror erotic thriller film which was directed by Fred Olen Ray (credited as Ed Raymond) and stars Kari Wührer, B R | 1h 38min | Horror, Thriller | Video 21 October 2003.  ... A burned out L.A. detective moves to Hawaii, where he stumbles upon a murder at a colleg",1
Academic term,"An academic term (or simply term) is a portion of an academic year, the time during which an educational institution holds classes. The schedules adop Sep 24, 2019 · Cambridge College ›› Offices & Resources ››.  ... Fall Term 2019-2020.  ... 03 Last day to submit application for degree/certificate fo This page contains the official academic calendar for the University of Massachusetts Boston.",4
Admissions,"Learn more about admissions requirements, timeline, and what we look for in an applicant. Find college admissions information including our majors, application requirements, housing and more. Get started on becoming a Boilermaker today! Email: undergrad.admissions@umb.edu. Graduate Admissions Phone: 617.287. 6400. Email: graduate.admissions@umb.edu. Financial Aid Phone: 617.287.",1
Athlete,"Athlete definition is - a person who is trained or skilled in exercises, sports, or games requiring physical strength, agility, or stamina. How to use An athlete or sportspeople (also sportsman or sportswoman) is a person who competes in one or more sports that involve physical strength, speed or end 4 days ago · athlete meaning: 1. a person who is very good at sports or physical exercise, especially one who competes in…. Learn more.",1
Academic personnel,"The Office of Academic Personnel is a service organization whose mission is to facilitate the recruitment, appointment, advancement, and development o Academic personnel, also known as faculty (in North American usage) or academics or academic staff are the staff of a university: professors of variou Academic Personnel Policy Revision 2017.  ... The Academic Personnel Policy (APP) defines the personnel policies (appointment, promotion, tenure, empl",0
Alumnus,"Do you know if you're an alumnus or an alumni? Alumni actually is the plural form of alumnus, a Latin word that means a graduate or former student of  Alumnus definition is - a person who has attended or has graduated from a particular school, college, or university —usually used of a man in the sing An alumnus or an alumna of a college, university, or other school is a former student who has either attended or graduated in some fashion from the in",2
John Harvard,"John Harvard (1607–1638) was an English minister in America, ""a godly gentleman and a lover of learning"" whose deathbed bequest to the ""schoale or ... John Harvard is a sculpture in bronze by Daniel Chester French in Harvard Yard, Cambridge, Massachusetts honoring John Harvard (1607–1638), whose ...
 6 days ago · John Harvard, (born November 1607, London, Eng.—died Sept. 14, 1638, Charlestown [part of Boston], Mass.  [U.S.]), New England colonist w",3
Wait list,"The first known use of wait-list was in 1960. See more words from the same year. More from Merriam-Webster on wait-list. Rhyming Dictionary: Words tha Wait list, in university and college admissions, is a term used in the United States and other countries to describe a situation in which a college or Waitlist definition, to place on a waiting list: All they could do was to waitlist us for the afternoon flight. See more.",1
College Confidential,"Finding--and getting into--the right college isn't easy. We guide you through it. Search colleges based on fit, learn what it takes to get in, figure  Oct 27, 2014 · Ah, College Confidential: the web's premier community for college-bound individuals. Some love it, some have described it as, “an absol As the world's largest college forum, College Confidential helps students find their best-fit educational path by exploring colleges and careers, lear",1
Fencing,"Fencing is a group of three related combat sports. The three disciplines in modern fencing are the foil, the épée, and the sabre (also saber); winning Located in Cambridge, MA, Olympia Fencing Center is the gathering place of fencing enthusiasts around Boston. Join our team of champions today! Boston Fencing Club is the oldest fencing club in the country - since 1858. BFC is a non-profit organization dedicated to teaching the Olympic sport o",1
Harvard Crimson fencing,"Men's Fencing · Home · Roster · Coaches · Schedule · News · Archives · Record Book · Videos · Recruit Questionnaire. Top Stories; Headlines. Geoffrey  Women's Fencing · Home · Roster · Coaches · Schedule · News · Archives · Record Book · Videos · Recruit Questionnaire. Top Stories; Headlines. The Harvard Crimson fencing team is the intercollegiate fencing team for Harvard University located in Cambridge, Massachusetts. The team competes in ",3
Physics,"Physics is the natural science that studies matter, its motion and behavior through space and time, and that studies the related entities of energy an Physics is the study of the basic principles that govern the physical world around us. We'll start by looking at motion itself. Then, we'll learn abou Your guide to physics on the web. physics.org is the place to be if you have a burning physics question, or if you just want to browse articles and in",1
Harvard Alumni Association,"Explore the latest happenings and get involved with your Harvard alumni ... Get to know some of ...+Alumni Services+About the HAA Reconnect with Harvard and your classmates through our alumni directory, ... HAA Award Recipients Announced ... Follow @HarvardAlumni Harvard Alumni .",3
Scandal,"Scandal is an American political thriller television series starring Kerry Washington. Created by Shonda Rhimes, it aired on ABC from April 5, 2012, u Watch the official Scandal online at ABC.com. Get exclusive videos, blogs, photos, cast bios, free episodes. Rating  7.7/10  (64,398) TV-14 | 43min | Drama, Thriller | TV Series (2012–2018)  ... A former White House Communications Director starts her own cris",1
Harvard Hillel,"Harvard Hillel is the catalyst for Jewish life, community, and personal exploration on Harvard University's campus. Oct 24, 2019 · Harvard Hillel is the catalyst for Jewish life at Harvard University, transforming participants into creators, inspiring and enabling s Rating  4.9  (8) Harvard Hillel, Cambridge, MA. 1589 likes · 5 talking about this · 329 were here. Welcome to Harvard Hillel, the catalyst for Jewish ",3
Student financial aid,"Use the Free Application for Federal Student Aid (FAFSA®) form to apply for ...
Filling Out the FAFSA® Form · myStudentAid app · Types of Aid · The FS Federal Student Aid, an office of the U.S. Department of Education: Proud sponsor ... can help you pay for education expenses not covered by other fin Sep 6, 2019 · Financial Aid for Students. If you need help paying for college, technical, or career school, check out the options you may be eligible ",2
Office for the Arts at Harvard,"Adriana Colón '12 says artists are scavengers, always asking ""What can I make from this?"" She will be on campus coaching the cast of West Side Story o Office of Career Services Faculty of Arts & Sciences Harvard University 54 Dunster Street Cambridge, MA 02138 617-495-2595 ocsrecep@fas.harvard.edu  . The Office for the Arts at Harvard (OFA) supports student engagement in the arts and integrates the arts into University life. Through its programs an",3
Human resource,"A human resource is an employee who staffs a function within an organization. Find out more about the people, the career, and resources to help you.
A Human resources are the people who make up the workforce of an organization, business sector, or economy. ""Human capital"" is sometimes used ...
Human  Human resources is used to describe both the people who work for a company or organization and the department responsible for managing resources relat",1
Law school,2 days ago · Recent J.D. recipients have different opinions about whether law school is worth the cost. Harvard Law School is one of the preeminent centers of legal education in the world. Led by a diverse and dedicated group of faculty and legal scholar,2
Harvard Pilgrim Health Care,"Harvard Pilgrim is a leading not-for-profit health services company serving members in Connecticut, Maine, Massachusetts, New Hampshire and beyond. Harvard Pilgrim Health Care is a not-for-profit health services company based in the New England region of the United States. On August 14, 2019, the  The Harvard Pilgrim Health Care Institute's Department of Population Medicine is a unique collaboration between Harvard Pilgrim Health Care and Harvar",3
The Harvard Gazette,"Official news from Harvard covering innovation in teaching, learning, and research. The Harvard Gazette is the official news outlet for Harvard University, covering Harvard innovation and discovery in teaching, learning, and research ",3
The Harvard Lampoon,"I hate to brag but I am pretty darn successful. I got a lifted ford ranger, a solid 6.5 wife (a Canada 5), a sick gig managing a Tim Horton's – with a The first volume of the Lampoon appeared in February, 1876. ... on Punch, the British humor magazine, the debut issue took the Harvard campus by storm The Harvard Lampoon is an undergraduate humor publication founded in 1876 by seven undergraduates at Harvard University in Cambridge, Massachusetts.
O",3
Mount Auburn Street,"Built in 1890, this wood-framed building features attractive landscaping and is close to the shops and restaurants on Massachusetts Avenue. Selected . This 1904 brick building is located right in Harvard Square. It is in the Mount Auburn Property Management Group. These units are expected to be offer 330 Mount Auburn Street Cambridge, MA 02138. Get walking ... Mount Auburn Cardiology Associates. 725 Concord Avenue Suite 3200. Cambridge, MA 02138.",1
Dormitory,"A dormitory is a building primarily providing sleeping and residential quarters for large numbers of people such as boarding school, high school, coll Dormitory definition is - a room for sleeping; especially : a large room containing numerous beds. How to use dormitory in a sentence. 4 days ago · dormitory meaning: 1. a large room containing many beds, for example in a boarding school 2. a large building at a…. Learn more.",2
Masters Degree,"A master's degree (from Latin magister) is an academic degree awarded by universities or colleges upon completion of a course of study demonstrating m You don’t have to be a bachelor to get a bachelor’s degree, but you do need to demonstrate mastery to get a master’s degree.  Either way, you should k Learn how and why to get a master's degree. Find career paths that align with the highest paying master's degrees. View program requirements, length.",1
Ronald S Sullivan Jr,"Professor Sullivan is a leading theorist in the areas of criminal law, criminal procedure, trial practice and techniques, legal ethics, and race theor Ronald S. Sullivan Jr is a law professor at Harvard Law School. Sullivan graduated Phi Beta Kappa from Morehouse College in 1989 and received his Juri May 11, 2019 · Ronald S. Sullivan Jr. and Stephanie Robinson led Winthrop House to commencement in 2017. They were the first African-American faculty ",2
Crimson,"3 days ago · Fifty-two percent of respondents to Harvard's pilot Pulse Survey on Inclusion and Belong said they agree or strongly agree with a stateme The Harvard Crimson, the daily student newspaper of Harvard University, was founded in 1873. It is the only daily newspaper in Cambridge, Massachusett Crimson is a strong, red color, inclining to purple. It originally meant the color of the kermes dye produced from a scale insect, Kermes vermilio, bu",3
Winthrop House,"If the Harvard College House System is best compared to Hogwarts, then Winthrop is definitely the Gryffindor of the 12 undergraduate Houses of Harvard Winthrop House Common Areas.  Winthrop House is composed of Standish and Gore Halls, both of which have a rich history (see below) and boast a variety John Winthrop House (commonly Winthrop House) is one of twelve undergraduate residential Houses at Harvard University. It is home to approximately 400",3
Jorge I Domínguez,"Jorge I. Domínguez (born 1945), a leading scholar of Latin American studies in the United States, taught at Harvard University from 1972 to 2018, when May 23, 2018 · The Chronicle of Higher Education published two articles in which 18 women publicly accused Government Professor Jorge I. Dominguez of  May 9, 2019 · Dominguez Stripped of Emeritus Status Following Conclusion of Title ... that she has stripped former Government Professor Jorge I. Domin",4
Memorial Church,"The Memorial Church of Harvard University is a space of grace at the center of Harvard Yard serving the entire Harvard University community and beyond The Memorial Church of Harvard University, more commonly known as the Harvard Memorial Church (or simply MemChurch) is a building on the campus of  .. The latest from MemChurch: Listen to the Rev. Kaji Douša's powerful sermon from last Sunday; Tomorrow: Harvard UChoir & HBCO Fall Concert at 4pm - mai",3
Speech,"Speech is human vocal communication using language. Each language uses phonetic combinations of vowel and consonant sounds that form the sound of its  These example sentences are selected automatically from various online news sources to reflect current usage of the word 'speech.'  Views expressed in From Middle English speche, from Old English spǣċ, sprǣċ (“speech, discourse, language”), from Proto-Germanic *sprēkijō, *sprēkō (“speech, language”),",1
Harvard Office of Career Services,"The Office of Career Services is dedicated to educating, advising, and connecting students to opportunities for summer and post-graduation in order to 6 days ago · The Office of Career Services (OCS) assists GSAS students and alumni in preparing for their professional futures. Through individual advi The Office of Career Services (OCS) is a team of advisors and recruitment professionals who work with current students, alumni, and employers with a f",1
Latin honors,"Latin honors are Latin phrases used in some colleges and universities to indicate the level of distinction with which an academic degree has been earn As a bachelor's degree student, if you have a sufficiently high grade point average (GPA) upon degree conferral, you will receive Latin Honor designat Jun 25, 2019 · Collectively known as Latin honors, these three terms signify varying levels of high academic achievement. Latin honors are conferred a",4
History and traditions of Harvard commencements,"What was originally called Harvard Colledge held its first Commencement in September 1642, when nine degrees were conferred. Today some 1700 ...
Daybr The Spirit & Spectacle of Harvard Commencement ... The clear-cut lines of history can snip ribbons and bows alike to give us a glimpse inside the box. What was originally called Harvard Colledge (around which Harvard University eventually grew) held its first Commencement in September 1642, when nine",3
Bookselling,"Bookselling is the commercial trading of books which is the retail and distribution end of the publishing process. People who engage in bookselling ar Oct 6, 2018 · Bookselling has been relentlessly romanticised, most often by Hollywood: in truth , it is further away from You've Got Mail (Tom Hanks's 3 days ago · Bookselling This Week recently talked to the owners of three bookstores with retail spaces under 1,500 square feet to see how they maximi",1
Science museum,"Features a revolving schedule of temporary exhibits, IMAX films, and Planetarium shows, plus details on more than 700 interactive permanent exhibits,  Plan ahead and buy your BODY WORLDS or general Exhibit Halls tickets at least one day before your visit and save $3 on each ticket.  Discount will be  The Museum of Science (MoS) is a science museum and indoor zoo in Boston, Massachusetts, located in Science Park, a plot of land spanning the Charles ",1
Dean,"Kwon Hyuk (Korean: 권혁; born November 10, 1992), better known by his stage name Dean, is a South Korean alternative R&B singer-songwriter, rapper and . Title[edit]. Dean (education) · Dean (Christianity), persons in certain positions of authority within a religious hierarchy; The head of a Bar associa Official Dean Guitars website showing the world's finest selection of Electric Guitars, Bass Guitars, Acoustic Guitars, guitar pickups guitar amps, an",1
Art museum,"The Harvard Art Museums — the Fogg, Busch-Reisinger, and Arthur M. Sackler Museums. Advanced Search. Classification; Work Type; Technique / Medium ... The Harvard Art Museums are committed to creating an environment that fosters ... The Art Study Center welcomes visitors by appointment (free with mus The MFA is one of the most comprehensive art museums in the world; the collection encompasses nearly 450000 works of art. We welcome more than one  ..",3
Kyle Kashuv,"Just to be very clear about the Gaza situation:  Gaza just launched 10 rockets at Israel. Israel has absolutely every right to defend itself. No other Kyle Kashuv (born May 20, 2001) is an American conservative activist. He survived the 2018 Stoneman Douglas High School shooting and subsequently ...
 Jun 17, 2019 · A teen conservative activist got in trouble for past racist comments.  ... Kashuv is a recent graduate of Marjory Stoneman Douglas High",2
Richard A and Susan F Smith Campus Center,"The Richard A. and Susan F. Smith Campus Center. The Smith Campus Center is a dynamic center of University life, enabling the greater Harvard communit Harvard Affiliates – 10th Floor of the Smith Campus Center The Heights ... Richard A. and Susan F. Smith Campus Center, Room 734. Cambridge, MA 02138 The Smith Campus Center serves as a welcoming and vibrant entrance to Harvard University as well ... While many of the spaces within the Smith Campus ",3
Academic conference,"An academic conference or scientific conference is an event for researchers (not necessarily academics) to present and discuss their work. Together wi Feb 19, 2019 · Are you making the most of the academic conferences you're attending? Read this guide to find out if you're missing a trick. Insight on what takes place at academic conferences, presenting your work, networking and paying for it all.",4
University of Cambridge,"The mission of the University of Cambridge is to contribute to society through the pursuit of education, learning and research at the highest internat The University of Cambridge is a collegiate public research university in Cambridge, United Kingdom. Founded in 1209 and granted a royal charter by Ki Thinking of #postgraduate study at #Cambridge? Here's how to apply ⬇  @Cam_Grads #CambridgeOpenDays pic.twitter.com/1fZ6bH1X6…",0
Parkland,"On February 14, 2018, a gunman opened fire with a semi-automatic rifle at Marjory Stoneman Douglas High School in Parkland, Florida, in the Miami ...
 Parkland is a city in Broward County, Florida, United States. As of the 2010 census, the population of Parkland was 23,962. Parkland is part of the Mi Feb 15, 2018 · The teen gunman accused of opening fire with a semi-automatic rifle at his former high school in Parkland, Florida, has been charged wi",2
Harvard Crimson mens ice hockey,"... sale for the Harvard Crimson men's and women's basketball and hockey teams . Full Story · James Marcou joins the Harvard men's ice hockey coaching 2018-19 Harvard Men's Ice Hockey Roster ... Wt.: 205, Hometown: Grosse Pointe, Mich. High School: University Liggett School. No.: 6, Colton Kerfoot fu 2018-19 Harvard Men's Ice Hockey Schedule. Overall 19-11- .... Boston University. ESPN+. Final - .... Lake Placid, N.Y. ECAC Hockey Semifinals l ESPN+",3
SAT,"Millions of students take the SAT each year as a step on their path to college. Visit our site to learn about the test, register, practice, and get yo",1
Fellow,"Greetings fellow coffee lovers. What happens when a love for coffee and a passion for product design meet up for a romantic candlelit dinner? Fellow h Fellow definition is - comrade, associate. How to use fellow in a sentence. Did You Know? A fellow is a member of an academy, learned society or group of learned people ( a fellowship) which works together in pursuing mutual knowledge or pr",1
American football,"American football, referred to as football in the United States and Canada and also known as gridiron, is a team sport played by two teams of eleven p American Football is an American rock band from Urbana, Illinois, United States, originally active from 1997 until 2000, and again from 2014. Guitaris Year One Demos documents the first proper demos we ever recorded and features versions of tracks that would later appear on our debut album and EP.
Li",1
Artificial intelligence,"In computer science, artificial intelligence (AI), sometimes called machine intelligence, is intelligence demonstrated by machines, in contrast to the “Everything we love about civilization is a product of intelligence, so amplifying our human intelligence with artificial intelligence has the potenti Artificial intelligence (AI) is wide-ranging branch of computer science concerned with building smart machines capable of performing tasks the typical",1
Harvard University Graduate School Of Design,"Back to top. The Graduate School of Design educates leaders in design, research, and scholarship to make a resilient, just, and beautiful world. The Harvard Graduate School of Design is a professional graduate school at Harvard University, located at Gund Hall, Cambridge, Massachusetts. The GSD Harvard Graduate School of Design, Cambridge, MA. 80K likes. This is the official page for the Harvard Graduate School of Design and is open to anyone",2
Harvard Kennedy School,"We believe that smart public policy and inspired public leadership can make people's lives safer, freer, and more prosperous. The John F. Kennedy School of Government at Harvard University is a public policy and public administration school, of Harvard ...
History · Academics The advantage for STEM majors fades steadily after their first jobs, and by age 40 the earnings of people who majored in fields like social science or",2
Senior management,"Senior management, executive management, upper management, or a management team is generally a team of individuals at the highest level of management  Definition of senior management: A group of high level executives that actively participate in the daily supervision, planning and administrative proc The title of senior manager is most often used and encountered in large organizations with multiple layers of management. A senior manager has ...",1
Harvard Book Store,"Explore book recommendations, author events, gifts, and more from Harvard ... Gift Cards: Redeemable at Harvard Book Store and online at harvard.com. Harvard Book Store is an independently run bookstore serving the greater Cambridge area. The bookstore is located in Harvard Square and has been ... Harvard Book Store is an independent and locally owned seller of used, new, and bargain books in Cambridge's Harvard Square. Harvard Book Store was ..",3
Racism,"Racism is the belief in the superiority of one race over another. It may also mean prejudice, discrimination, or antagonism directed against other peo Racism is the belief that a particular race is superior or inferior to another, that a person’s social and moral traits are predetermined by his or he Racism definition is - a belief that race is the primary determinant of human traits and capacities and that racial differences produce an inherent su",1
 Center for Nanoscale Systems,"The Center for Nanoscale Systems (CNS) is a shared-use core facility at Harvard University. Our scientific focus is the study, design and fabrication  The Center for Nanoscale Systems (CNS) was created to support a very clear vision: The development of a collaborative multi-disciplinary research envi The Center for Nanoscale Systems (CNS) is the shared-use core facility at Harvard University for nanoscale research. We provide world-class, centraliz",0
Science Center,"The Science Center is open Monday through Sunday from 6am to 11:30pm. Harvard IDs are required to access to the building after hours. After 5:00 p.m.  Harvard Science Center 1 Oxford Street, Cambridge. IBM ASCC - Harvard Mark 1 IBM Automatic Sequence Controlled Calculator (ASCC) - Harvard Mark 1. The Harvard University Science Center is Harvard's main classroom and laboratory building for undergraduate science and mathematics, in addition to ho",3
Barack Obama,"Barack Hussein Obama II is an American attorney and politician who served as the 44th president of the United States from 2009 to 2017. A member of th Proud to endorse an outstanding group of Virginia Democrats in Tuesday’s election—candidates who’ll not only advance the causes of equality, justice, ",1
